Title,Link,Source
Understanding and Raising Money for Addiction Treatment,https://www.gofundme.com/c/blog/raise-money-addiction-treatment,gofundme.com
Drug Addiction - Fundraiser by Patricia Neal,https://www.gofundme.com/f/t3hvu-drug-addiction,gofundme.com
Paying for Prescriptions Made Easy: Seven Ideas to Help,https://www.gofundme.com/c/blog/paying-for-prescriptions,gofundme.com
Alcohol and Drug Addiction Fundraiser,https://www.gofundme.com/f/hqh2n5-alcohol-and-drug-addiction-fundraiser,gofundme.com
Help Support families affected by drugs & Alcohol,https://www.gofundme.com/f/help-support-families-affected-by-drugs-alcohol,gofundme.com
Help with Donny's Funeral Expenses & Kids' Future,https://www.gofundme.com/f/help-with-donnys-funeral-expenses-kids-future,gofundme.com
Addiction Treatment & After Care Housing,https://www.gofundme.com/f/addiction-treatment-after-care-housing?modal=share&source=top+nav,gofundme.com
Help Donna fight leukemia and addiction,https://www.gofundme.com/f/help-my-friend-overcome-cancer-and-addiction,gofundme.com
Help Elizabeth Madden's Journey to Independence,https://www.gofundme.com/f/help-elizabeth-maddens-journey-to-independence,gofundme.com
Help Robert beat Drug/Alcohol addiction. Go Rehab.,https://www.gofundme.com/f/drugs-amp-alcohol-addiction-treatmentrehab,gofundme.com
I can't afford my medication.,https://www.gofundme.com/f/8tmthx-i-cant-afford-my-medication,gofundme.com
25 Resources That Provide Financial Help for Seniors,https://www.gofundme.com/c/blog/financial-help-for-seniors,gofundme.com
Nicole Smith-Holt's Quest for Affordable Insulin,https://www.gofundme.com/f/Nicole-Smith-Holt,gofundme.com
Healthcare Equity through Community Pharmacy,https://www.gofundme.com/f/sozowellness-medication-access,gofundme.com
Fundraiser by Theresa Homan : Medication Help,https://www.gofundme.com/f/vngcdn-medication-help/donations,gofundme.com
Brilinta Prescription - Fundraiser by Angela Sparks,https://www.gofundme.com/f/brilinta-prescription,gofundme.com
Fundraiser by Lisa Johnson : Medicine For Arch,https://www.gofundme.com/f/MedicineForArch,gofundme.com
Help Katlyn Cover Medical Costs in the US,https://www.gofundme.com/f/help-katlyn-cover-medical-costs?utm_campaign=p_cp_url&utm_medium=os&utm_source=customer&modal=donations&tab=top,gofundme.com
"Insurance Denied, Suffering Permitted",https://www.gofundme.com/f/insurance-denied-suffering-permitted,gofundme.com
Help Arash Access Medication,https://www.gofundme.com/f/help-arash-access-medication,gofundme.com
How to Get Help For Paying Unexpected Bills,https://www.gofundme.com/c/blog/how-to-get-help-with-bills,gofundme.com
How to Ask for Help With Money in 5 Steps,https://www.gofundme.com/c/blog/how-to-ask-for-help-with-money,gofundme.com
How to Get Help Paying Unexpected Medical Bills,https://www.gofundme.com/c/blog/pay-medical-bills,gofundme.com
GoFundMe | The #1 Crowdfunding and Fundraising Platform,https://www.gofundme.com/,gofundme.com
Payment options for donors – Help Center,https://support.gofundme.com/hc/en-us/articles/4402563115412-Payment-options-for-donors,gofundme.com
8 Steps for Getting Out of Debt – Fast,https://www.gofundme.com/c/blog/how-to-get-rid-of-debt,gofundme.com
Pricing and Fees,https://www.gofundme.com/c/pricing,gofundme.com
Paying for Prescriptions Made Easy: Seven Ideas to Help,https://www.gofundme.com/c/blog/paying-for-prescriptions,gofundme.com
How to Pay for a Lawyer: Top 3 Ways,https://www.gofundme.com/c/blog/how-to-pay-for-lawyer,gofundme.com
Paying tribute to Melissa,https://www.gofundme.com/f/paying-tribune-to-melissa,gofundme.com
